{
  "schema_version": 1,
  "contract_id": "safesort-official-2026-07-18",
  "locked_at": "2026-07-18",
  "labels": ["OFFICIAL", "DERIVED", "TEAM_SLO", "STRETCH"],
  "rubric_sections": [
    {"id": "PRE", "title": "Presentation", "points": 10, "scenario_id": "presentation-timed", "numeric_gate": {"metric": "duration_s", "operator": "<=", "threshold": 420}, "artifact_path": "submission/presentation.pdf", "requirement_ids": ["PRE-1", "PRE-2"]},
    {"id": "UGT", "title": "Readiness level", "points": 20, "scenario_id": "full-intelligent-cycle", "numeric_gate": {"metric": "ugt_level", "operator": ">=", "threshold": 4}, "artifact_path": "evidence/ugt/acceptance-report.json", "requirement_ids": ["UGT-1", "UGT-2", "UGT-3", "UGT-4"]},
    {"id": "CLS", "title": "Category correctness", "points": 20, "scenario_id": "classification-boundaries", "numeric_gate": {"metric": "official_accuracy", "operator": ">=", "threshold": 0.99}, "artifact_path": "evidence/classification/summary.json", "requirement_ids": ["CLS-1", "CLS-2", "CLS-3", "CLS-4", "CLS-5", "CLS-6", "CLS-7"]},
    {"id": "EXE", "title": "Execution and routing", "points": 30, "scenario_id": "physical-routing-balanced", "numeric_gate": {"metric": "confirmed_route_accuracy", "operator": ">=", "threshold": 0.995}, "artifact_path": "evidence/execution/route-matrix.json", "requirement_ids": ["EXE-1", "EXE-2", "EXE-3", "EXE-4", "EXE-5", "EXE-6", "EXE-7"]},
    {"id": "PERF", "title": "Performance and faults", "points": 20, "scenario_id": "one-hour-flow", "numeric_gate": {"metric": "final_backlog", "operator": "=", "threshold": 0}, "artifact_path": "evidence/performance/hourly-metrics.json", "requirement_ids": ["PERF-1", "PERF-2", "PERF-3", "PERF-4", "PERF-5", "PERF-6"]},
    {"id": "INT", "title": "Connectivity and engineering realism", "points": 15, "scenario_id": "runtime-isolation", "numeric_gate": {"metric": "forbidden_runtime_accesses", "operator": "=", "threshold": 0}, "artifact_path": "evidence/integration/leak-guard.json", "requirement_ids": ["INT-1", "INT-2", "INT-3", "INT-4", "INT-5", "INT-6", "INT-7"]},
    {"id": "REP", "title": "Reporting and reproducibility", "points": 15, "scenario_id": "clean-cpu-reproduction", "numeric_gate": {"metric": "identical_runs", "operator": "=", "threshold": 3}, "artifact_path": "evidence/release/reproducibility.json", "requirement_ids": ["REP-1", "REP-2", "REP-3", "REP-4", "REP-5"]}
  ],
  "scenario_families": [
    {"id": "PRE", "name": "presentation", "evidence_owner": "presentation-lead"},
    {"id": "UGT", "name": "readiness", "evidence_owner": "evaluation-lead"},
    {"id": "CLS", "name": "classification", "evidence_owner": "perception-lead"},
    {"id": "EXE", "name": "execution", "evidence_owner": "controls-lead"},
    {"id": "PERF", "name": "performance-faults", "evidence_owner": "reliability-lead"},
    {"id": "INT", "name": "integration-realism", "evidence_owner": "architecture-lead"},
    {"id": "REP", "name": "reporting-release", "evidence_owner": "release-lead"}
  ],
  "requirements": [
    {"id": "PRE-1", "family": "PRE", "label": "OFFICIAL", "source_ref": "official:criteria", "scenario_id": "presentation-timed", "numeric_gate": {"metric": "duration_s", "operator": "<=", "threshold": 420}, "artifact_path": "submission/presentation.pdf"},
    {"id": "PRE-2", "family": "PRE", "label": "TEAM_SLO", "source_ref": "team:evidence-discoverability", "scenario_id": "evidence-discoverability", "numeric_gate": {"metric": "max_link_hops", "operator": "<=", "threshold": 2}, "artifact_path": "evidence/review/discoverability.json"},
    {"id": "UGT-1", "family": "UGT", "label": "TEAM_SLO", "source_ref": "team:official-set", "scenario_id": "official-11x24", "numeric_gate": {"metric": "correct_decisions", "operator": "=", "threshold": 264}, "artifact_path": "evidence/ugt/official-set.json"},
    {"id": "UGT-2", "family": "UGT", "label": "TEAM_SLO", "source_ref": "team:hidden-like", "scenario_id": "hidden-like-300x12", "numeric_gate": {"metric": "accuracy", "operator": ">=", "threshold": 0.99}, "artifact_path": "evidence/ugt/hidden-like.json"},
    {"id": "UGT-3", "family": "UGT", "label": "TEAM_SLO", "source_ref": "team:calculation-simulation", "scenario_id": "calculation-vs-simulation", "numeric_gate": {"metric": "cycle_time_delta", "operator": "<=", "threshold": 0.05}, "artifact_path": "evidence/ugt/calculation-comparison.json"},
    {"id": "UGT-4", "family": "UGT", "label": "OFFICIAL", "source_ref": "official:criteria", "scenario_id": "full-intelligent-cycle", "numeric_gate": {"metric": "manual_truth_injections", "operator": "=", "threshold": 0}, "artifact_path": "evidence/ugt/acceptance-report.json"},
    {"id": "CLS-1", "family": "CLS", "label": "TEAM_SLO", "source_ref": "team:rule-table", "scenario_id": "rule-engine-table", "numeric_gate": {"metric": "property_test_pass_rate", "operator": "=", "threshold": 1.0}, "artifact_path": "evidence/classification/rule-engine-tests.json"},
    {"id": "CLS-2", "family": "CLS", "label": "OFFICIAL", "source_ref": "official:task", "scenario_id": "dimension-boundaries", "numeric_gate": {"metric": "false_b_at_boundaries", "operator": "=", "threshold": 0}, "artifact_path": "evidence/classification/dimension-boundaries.json"},
    {"id": "CLS-3", "family": "CLS", "label": "OFFICIAL", "source_ref": "official:task", "scenario_id": "circularity-boundary", "numeric_gate": {"metric": "k_threshold", "operator": ">", "threshold": 0.8}, "artifact_path": "evidence/classification/shape-boundary.json"},
    {"id": "CLS-4", "family": "CLS", "label": "OFFICIAL", "source_ref": "official:task", "scenario_id": "dimension-before-shape", "numeric_gate": {"metric": "round_oversize_routed_c", "operator": "=", "threshold": 1.0}, "artifact_path": "evidence/classification/priority.json"},
    {"id": "CLS-5", "family": "CLS", "label": "TEAM_SLO", "source_ref": "team:uncertainty-band", "scenario_id": "boundary-uncertainty", "numeric_gate": {"metric": "unsafe_b_inside_band", "operator": "=", "threshold": 0}, "artifact_path": "evidence/classification/uncertainty.json"},
    {"id": "CLS-6", "family": "CLS", "label": "TEAM_SLO", "source_ref": "team:private-stl", "scenario_id": "private-renamed-stl", "numeric_gate": {"metric": "loaded_without_crash", "operator": "=", "threshold": 50}, "artifact_path": "evidence/classification/private-stl.json"},
    {"id": "CLS-7", "family": "CLS", "label": "OFFICIAL", "source_ref": "official:accuracy-semantics", "scenario_id": "abstain-accounting", "numeric_gate": {"metric": "abstains_excluded_from_denominator", "operator": "=", "threshold": 0}, "artifact_path": "evidence/classification/abstain-accounting.json"},
    {"id": "EXE-1", "family": "EXE", "label": "TEAM_SLO", "source_ref": "team:balanced-stream", "scenario_id": "physical-routing-balanced", "numeric_gate": {"metric": "confirmed_route_accuracy", "operator": ">=", "threshold": 0.995}, "artifact_path": "evidence/execution/route-matrix.json"},
    {"id": "EXE-2", "family": "EXE", "label": "OFFICIAL", "source_ref": "official:physical-cycle", "scenario_id": "confirmed-exit-cycle", "numeric_gate": {"metric": "success_without_exit", "operator": "=", "threshold": 0}, "artifact_path": "evidence/execution/item-timeline.json"},
    {"id": "EXE-3", "family": "EXE", "label": "TEAM_SLO", "source_ref": "team:varied-geometry", "scenario_id": "geometry-pose-mass", "numeric_gate": {"metric": "completed_routes", "operator": ">=", "threshold": 0.99}, "artifact_path": "evidence/execution/geometry-matrix.json"},
    {"id": "EXE-4", "family": "EXE", "label": "TEAM_SLO", "source_ref": "team:manipulation-quality", "scenario_id": "fragile-rolling-unstable", "numeric_gate": {"metric": "route_changing_failures", "operator": "=", "threshold": 0}, "artifact_path": "evidence/execution/contact-impulses.json"},
    {"id": "EXE-5", "family": "EXE", "label": "TEAM_SLO", "source_ref": "team:passive-safety", "scenario_id": "gate-power-loss", "numeric_gate": {"metric": "unsafe_b_routes", "operator": "=", "threshold": 0}, "artifact_path": "evidence/execution/passive-safety.json"},
    {"id": "EXE-6", "family": "EXE", "label": "TEAM_SLO", "source_ref": "team:estop", "scenario_id": "estop-all-states", "numeric_gate": {"metric": "zero_command_steps", "operator": "<=", "threshold": 2}, "artifact_path": "evidence/execution/estop.json"},
    {"id": "EXE-7", "family": "EXE", "label": "TEAM_SLO", "source_ref": "team:proxy-fidelity", "scenario_id": "proxy-vs-source", "numeric_gate": {"metric": "bbox_error_mm", "operator": "<=", "threshold": 3}, "artifact_path": "evidence/execution/proxy-fidelity.json"},
    {"id": "PERF-1", "family": "PERF", "label": "DERIVED", "source_ref": "derived:belt-spacing", "scenario_id": "one-hour-flow", "numeric_gate": {"metric": "arrivals_per_hour", "operator": "=", "threshold": 5143}, "artifact_path": "evidence/performance/hourly-metrics.json"},
    {"id": "PERF-2", "family": "PERF", "label": "TEAM_SLO", "source_ref": "team:decision-deadline", "scenario_id": "variable-worker-latency", "numeric_gate": {"metric": "deadline_success", "operator": ">=", "threshold": 0.999}, "artifact_path": "evidence/performance/latency.json"},
    {"id": "PERF-3", "family": "PERF", "label": "TEAM_SLO", "source_ref": "team:identity-stress", "scenario_id": "reordered-completions-100k", "numeric_gate": {"metric": "identity_errors", "operator": "=", "threshold": 0}, "artifact_path": "evidence/performance/item-ledger.json"},
    {"id": "PERF-4", "family": "PERF", "label": "TEAM_SLO", "source_ref": "team:recovery", "scenario_id": "temporary-slowdown", "numeric_gate": {"metric": "recovery_s", "operator": "<=", "threshold": 5}, "artifact_path": "evidence/performance/recovery.json"},
    {"id": "PERF-5", "family": "PERF", "label": "TEAM_SLO", "source_ref": "team:fault-matrix", "scenario_id": "fault-matrix-100-seeds", "numeric_gate": {"metric": "unsafe_b_routes", "operator": "=", "threshold": 0}, "artifact_path": "evidence/performance/fault-matrix.json"},